user_question,label_1
Здравствуйте! Можно уточнить причины Правилhttps://rutube.ru/info/taboo_agreement/ по которым удаляются ролики? что за нарушение правил RUTUBE ‌ ‌ ‌ ‌ ‌ ‌ ‌ ‌ ‌ ‌ ‌ ‌ ‌ ‌ ‌ ‌ ‌ ‌ ‌ ‌ ‌ ‌ ‌ ‌ ‌ ‌ ‌ ‌ ‌ ‌ ‌ ‌ ‌ ‌ ‌ ‌ ‌ ‌ ‌ ‌ ‌ ‌ ‌ ‌ ‌ ‌ ‌ ‌ ‌ ‌ ‌ ‌ ‌ ‌ ‌ ‌ ‌ ‌ ‌ ‌ ‌ ‌ ‌ ‌ ‌ ‌ ‌ ‌ ‌ ‌ ‌ ‌ ‌ ‌ ‌ ‌ ‌ ‌ ‌ ‌ ‌ ‌ ‌ ‌ ‌ ‌ ‌ ‌ ‌ ‌ ‌ ‌ ‌ ‌ ‌ ‌ ‌ ‌ ‌ ‌ ‌ ‌ ‌ ‌ ‌ ‌ ‌ ‌ ‌ ‌ ‌ ‌ ‌ ‌ ‌ ‌ ‌ ‌ ‌ ‌ ‌ ‌ ‌ ‌ ‌ ‌ ‌ ‌ ‌ ‌ ‌ ‌ ‌ ‌ ‌ ‌ ‌ ‌ ‌ ‌ ‌ ‌ ‌ ‌ ‌ ,МОДЕРАЦИЯ
"Добрый вечер, какой топ причин блокировки видео на рутубе?",МОДЕРАЦИЯ
"Все пишут, что монетизация на рутубе отключается сама собой, у меня тоже так будет?",МОНЕТИЗАЦИЯ
Что запрещено в монетизации и что можно выкладывать?,МОНЕТИЗАЦИЯ
"Чтобы не отключали монетизацию, надо, чтобы я сам снимал видео?",МОНЕТИЗАЦИЯ
"Можно ли мне накрутить просмотры, не будет нарушением? Все равно же это просмотры ",МОНЕТИЗАЦИЯ
"Если коменты и просмотрынакрученны, рутуб с таким явлением что-то делает?",МОНЕТИЗАЦИЯ
Какой статус мне выбрать для монетизации?,МОНЕТИЗАЦИЯ
"Если я превышу лимит по самозанятости, с монетизацией все будет хорошо?",МОНЕТИЗАЦИЯ
"Подскажите, пожалуйста, что не запрещено выкладывать в монетизации?",МОНЕТИЗАЦИЯ
"Какую музыку можно использовать в видео, чтобы получать доход от просмотров?",МОНЕТИЗАЦИЯ
Я заю что музыку нельзя размещать!  А если сам ее написал или с сайта то как,МОНЕТИЗАЦИЯ
У контента из интернета есть авторские права?,МОДЕРАЦИЯ
Что защищено авторским правом? Какие материалы,МОДЕРАЦИЯ
"Какие документы нужны для восстановления монетизации, ели это чужие видео?",МОНЕТИЗАЦИЯ
"Добрый день, я бы хотел узнать какие документы я должен предоставить чтобы мог загружать определенные фильмы и мультфильмы? у меня есть разрешения на некоторые фильмы и мультфильмы просто, надо включить монетизацию",МОНЕТИЗАЦИЯ
"Если я видео размещаю, авторские права у вас будут?",МОДЕРАЦИЯ
кто правообладатель аорских прав на размещенный ролик на канале?,МОДЕРАЦИЯ
Кому принадлежат авторские права на данный контент?,МОДЕРАЦИЯ
"пройдет видео модерация, если цитировать чужие материалы?",МОДЕРАЦИЯ
Могу я в видео процитировать произведение известного нейрохирурга?,МОДЕРАЦИЯ
Не запрещено цитировать произведения?,МОДЕРАЦИЯ
"Пытался загрузить фильм и получаю:""Видео удалено за нарушение пользовательского соглашения""почему так?",МОДЕРАЦИЯ
"можно ли делать вставки из чужие роликов мини фильмов, будет опубликовано?",МОДЕРАЦИЯ
"Если беру материалы для публикации интернета, надо вам что-то предоставлять?",МОДЕРАЦИЯ
ролики из инета защищены авторским правом?,МОДЕРАЦИЯ
"Что сделать, чтобы использовать в видео материалы, которые распространяются по свободной лицензии?",МОДЕРАЦИЯ
"Могу я использовать музыку, которая распространяется по свободной лицензии?",МОДЕРАЦИЯ
Какие видео  с чтением чужих книг можно публиковать?,МОДЕРАЦИЯ
"ВОПРОС ОБ ОТКАЗЕ ОТ ПУБЛИКОВАНИЯ ПРОИЗВЕДЕНИЯ ОБЩЕСТВЕННОГО ДОСТОЯНИЯ, БУДЕТ ТАКОЕ?",МОДЕРАЦИЯ
Что за переход в общественное достояние?,МОДЕРАЦИЯ
через сколько лет переход общественное достояние?,МОДЕРАЦИЯ
произведние в общественном достоянии? О чем это?,МОДЕРАЦИЯ
"Почему не скажете, кому пренадлежат эти права?",МОДЕРАЦИЯ
"Кто этот правообладатель прав, почему не уведомляете фамилией?",МОДЕРАЦИЯ
Некоторые комментарии  и видео фильтры Рутуба почему-то пропускают. Пожаловаться тоже непонятно как  среди сотен отзывов весьма проблематично.Спасибо.,МОДЕРАЦИЯ
"Доброго дня хочу пожаловаться на видео. В этом видео автор канала просит скидывать денежные средства, на электронные кошельки указанные в описание к видео, при этом не предоставив никаких документов.  Усматривают в этом нарушение законодательства РФ, а именно 151 статью УК РФ -Попрошайничество и статья мошенничество 159 УК РФ.  Прошу незамедлительно заблокировать данное видео на вашей платформе",МОДЕРАЦИЯ
"Помимо обычного рутуба есть какое-то приложение для автора, что это?",УПРАВЛЕНИЕ АККАУНТОМ
Сделайт уже студию для андроида,УПРАВЛЕНИЕ АККАУНТОМ
"не хочу пользоваться студией с ноутбука, хочу с телефона",УПРАВЛЕНИЕ АККАУНТОМ
Что можно делать в приложени ситудии?,УПРАВЛЕНИЕ АККАУНТОМ
Никак с приложения нельзя посмотреть аналитику по каналу?,УПРАВЛЕНИЕ АККАУНТОМ
на всех устройствах доступно прилоежние студии?,ДОСТУП К RUTUBE
"Здравствуйте!Хочу скачать ваше приложение студии для устройства SberPortal но не могу инфу на вашем сайте, с каких версий доступно",ДОСТУП К RUTUBE
где посмотреть версию в студии на айос,ОТСУТСТВУЕТ
Есть ли данные о версии в приложения Студия RUTUBE ios?,ОТСУТСТВУЕТ
"где увидеть цифры версии, вы запрашиваете, а я не могу найти. Уже посмотрела везде, как я должна узнать, у меня айфон 11",ОТСУТСТВУЕТ
"Какой логин указывать в студии на смартфоне? Вхожу первый ра, у меня айфон 12, если надо",УПРАВЛЕНИЕ АККАУНТОМ
Можно ли регистрироваться в студии приложении ios на почту?,УПРАВЛЕНИЕ АККАУНТОМ
Какой логин указывать в студии на смартфоне? Забыла почта или номер нужен,УПРАВЛЕНИЕ АККАУНТОМ
Можно ли регистрироваться в студии приложении на почту?,УПРАВЛЕНИЕ АККАУНТОМ
МОЖНО ПОВТОРНО ВОЙТИ В ПРИЛОЖЕНИЕ СТУДИИ?,УПРАВЛЕНИЕ АККАУНТОМ
"Можно ли сделать так, чтобы в приложении студии и обычном приложении рутуба был один канал?",УПРАВЛЕНИЕ АККАУНТОМ
как можно выполнить вход в приложении Студия RUTUBE с пароле или без?,УПРАВЛЕНИЕ АККАУНТОМ
Обязательно ли код вводить при входе в студию?,УПРАВЛЕНИЕ АККАУНТОМ
Как без проверочного кода зайти в приложении студии?,УПРАВЛЕНИЕ АККАУНТОМ
Как можно выйти со всех устройств в пиложении студии? ,УПРАВЛЕНИЕ АККАУНТОМ
напишите пошагово действия как выйти из канала в приложении Студия RUTUBE,УПРАВЛЕНИЕ АККАУНТОМ
я могу вообще выйти из студии на айфоне?,УПРАВЛЕНИЕ АККАУНТОМ
какие данные можно менять в приложении Студия RUTUBE?,УПРАВЛЕНИЕ АККАУНТОМ
Как в приложении Студия RUTUBE мне изменить дату рождения?,УПРАВЛЕНИЕ АККАУНТОМ
Как в приложении Студия RUTUBE изменить номер телефона?,УПРАВЛЕНИЕ АККАУНТОМ
можно обновить в приложении Студия RUTUBE описание канала?,УПРАВЛЕНИЕ АККАУНТОМ
Где можно изменить название канала в студии на смартфорне?,УПРАВЛЕНИЕ АККАУНТОМ
как удалить канал в приложении Студия RUTUBE,УПРАВЛЕНИЕ АККАУНТОМ
"Здравствуйте ! Хочу удалить аккаунт, а кнопки удаления вроде нету ни в профиле, ни в студиии приложении. Как удалить?",УПРАВЛЕНИЕ АККАУНТОМ
как изменить фотку профиля в приложении студии?,УПРАВЛЕНИЕ АККАУНТОМ
можно ли в приложении Студия RUTUBE поменять фотографию канала?,УПРАВЛЕНИЕ АККАУНТОМ
как мне выдать доступы к студии канала через приложение Студия RUTUBE?,ПРЕДЛОЖЕНИЯ
уже можно настраивать доступп к студии через приложение?,ПРЕДЛОЖЕНИЯ
Как управлять другим каналом через приложение Студия RUTUBE?,ПРЕДЛОЖЕНИЯ
"могу я делать что-то на канале другого человека в приложении студия, если дали доступ?",ПРЕДЛОЖЕНИЯ
Что не так может быть с обложкой канала?,УПРАВЛЕНИЕ АККАУНТОМ
"Добрый день, не загружается обложка канала, пишет странный размер - не более 2204",УПРАВЛЕНИЕ АККАУНТОМ
"Можно скрыть разделы во вкладке ""Обзор"" в приложении Студия RUTUBE?",ПРЕДЛОЖЕНИЯ
"Можно ли менять местами  разделы во вкладке ""Обзор"" в приложении Студия RUTUBE?",ПРЕДЛОЖЕНИЯ
Можно ли увидеть аналитику по конкретному видео в приложении Студия RUTUBE?,ПРЕДЛОЖЕНИЯ
в приложении Студия как увидеть аналитику по всем видео?,ПРЕДЛОЖЕНИЯ
"Доброй ночи, возможно мои пожелания с 99% не учтут но все же ) Добавьте аналитику по все видео  в обычном приложении студии тоже было бы не плохо Добавил 4,5 скрин - как то скудно он выглядит на фоне других и не так удобно надеюсь на то что вы станете на 1 месте пока что в России а дальше и по миру",ПРЕДЛОЖЕНИЯ
сколько денег я заработал за видео в приложении студии?,ПРЕДЛОЖЕНИЯ
"Где посмотреть доход по ролику ""Тундра""? В студии не вижу, на сайте чтоль надо",ПРЕДЛОЖЕНИЯ
Как в студии рутуба на телефоне подать заявку на монетизацию?,ПРЕДЛОЖЕНИЯ
в студии рутуба вообще что ль нельзя документы на монетизацию отправить?,ПРЕДЛОЖЕНИЯ
Как в студии рутуба на телефоне создать свой плейлист?,ПРЕДЛОЖЕНИЯ
в студии рутуба вообще что ль нельзя плейлисты делать?,ПРЕДЛОЖЕНИЯ
Можно в студии в приложении грузить видео?,ПРЕДЛОЖЕНИЯ
загружать можно только в обычно приложении или в приложении студии тоже?,ПРЕДЛОЖЕНИЯ
Как в приложении Студия RUTUBE создавать трансляции?,ПРЕДЛОЖЕНИЯ
"запусть трансляции можно только на сайте студии, как это в студии приложения сделать?",ПРЕДЛОЖЕНИЯ
"Как отсортировать видео по статусу в категории ""Модерация/Отклонено"" в приложении Студия RUTUBE?",ПРЕДЛОЖЕНИЯ
как мне отклоненные видео отсортировать в студии на телефоне?,ПРЕДЛОЖЕНИЯ
"Добрый день. При загрузке видео загружаем изображение обложки, но после загрузки обложка не видна.  видео выходит ошибка «не удалось обновить оложку» Помогите с проблемой, подскажите как загрузить на видео обложки, какой она должна быть",ВИДЕО
"Добрый день, не загружается обложка видео, пишет странный размер - не мене 320 - 320, это что то новое?",ВИДЕО
любую обложку на видео можно загрузить или как?,ВИДЕО
"Как мне сстудии посмотреть что мне ответили в комментариях, я не могу найти это в приложении айос",ПРЕДЛОЖЕНИЯ
"Где в приложении студии на айфон раздел ""Комментарии""?",ПРЕДЛОЖЕНИЯ
уже организовали работу с комментариями в студии на смарфтоне или нет? Мне надо обновляться в appstore или нет?,ПРЕДЛОЖЕНИЯ
перенести видео в приложеиии нлельзя что ль? С ютуба только на сайте можно?,ПРЕДЛОЖЕНИЯ
в студии ios есть испорт видео с YouTub? Разом что б все,ПРЕДЛОЖЕНИЯ
проблемы со входом в приложении Студия RUTUBE,УПРАВЛЕНИЕ АККАУНТОМ
"какая почта, если проблемы со входом на акаунт студии, и что указать",УПРАВЛЕНИЕ АККАУНТОМ
как связаться с поддержкой в приле студии?,ОТСУТСТВУЕТ
как вам написать прямо из студии на смартфоне? Надо почту открывать?,ОТСУТСТВУЕТ
"куда нажать, чтобы увидеть кнопку поддержки в приложении Студия RUTUBE?",ОТСУТСТВУЕТ
"Помимо студии на сайте есть какое-то приложение для автора, оно ваше? Там почти также как в веб версии?",УПРАВЛЕНИЕ АККАУНТОМ
Сделайт уже студию для айфона,УПРАВЛЕНИЕ АККАУНТОМ
что за студия для смартфоно?,УПРАВЛЕНИЕ АККАУНТОМ
"функионал обычного приложения и студии для самсунга отличаются или нет? Меня конкрутно студия инстресует, что там можно",УПРАВЛЕНИЕ АККАУНТОМ
"Загрузка и редактирование видео, создание и редактирование плейлистов и трансляций доступно в приложении Студия RUTUBE?",УПРАВЛЕНИЕ АККАУНТОМ
как скачать студию на андроид,ДОСТУП К RUTUBE
как скачатть приложение для авторов студии на хуавей?,ДОСТУП К RUTUBE
Можно ли где-то скачать приложение Студия на android?,ДОСТУП К RUTUBE
"У меня телефон techno, можно установить Студию?",ДОСТУП К RUTUBE
"Здравствуйте! с каких версий доступно приложении студии, устаревшие версии телефонов андроид есть?",ДОСТУП К RUTUBE
где посмотреть версию в студии на андроиде,ОТСУТСТВУЕТ
Есть ли данные о версии в приложения Студия RUTUBE на xiaomi?,ОТСУТСТВУЕТ
"где увидеть цыфры версии, вы запрашиваете, а я не могу найти. Уже посмотрела везде, как я должна узнать, у меня хуавей",ОТСУТСТВУЕТ
есть студия рутуба для планшетов?,ДОСТУП К RUTUBE
Здравствуйте можно запустить рутуб ноо я на планшете?,ДОСТУП К RUTUBE
"Здравствуйте, а rutube оптимизирован для планшетов? Можно скачать?",ДОСТУП К RUTUBE
Какой логин указывать в студии на смартфоне? Вхожу первый раз на самсунге,УПРАВЛЕНИЕ АККАУНТОМ
Можно ли регистрироваться в студии приложении для андоида на телефон?,УПРАВЛЕНИЕ АККАУНТОМ
Забыла почта или номер нужен для входа  в прилу студии че делать,УПРАВЛЕНИЕ АККАУНТОМ
Могу зайти в студию приложение на андроид по номеру телефона? Также как на сайте или как надо то ничего не понятно сделайте уже яснее,УПРАВЛЕНИЕ АККАУНТОМ
можно сделать один аккунт и для сайта идля студии на смартфоне? Или надоразные,УПРАВЛЕНИЕ АККАУНТОМ
"Я ЗАРЕГИСТРИРОВАЛСЯ НА САЙТЕ, мне нада 2 профиль для студии на смартфоне или нет?",УПРАВЛЕНИЕ АККАУНТОМ
когда ответите уже как зайти без кода то в студию приложени?,УПРАВЛЕНИЕ АККАУНТОМ
надо обязательно ввести код? Чтобы подключить студию на смартфон,УПРАВЛЕНИЕ АККАУНТОМ
почему то туда отсылает Код...Как такое вообще возможно????? Как зайти без кода?????,УПРАВЛЕНИЕ АККАУНТОМ
Как выйти из акаунта в приложении студии?  ,УПРАВЛЕНИЕ АККАУНТОМ
"Здравствуйте!Как выйти из чужого аккаунта стдии на анроиде, чтобы зайти под моим аккаунтом?С уважением,Дмитрий",УПРАВЛЕНИЕ АККАУНТОМ
Я же указал дату рождения в профиле… а как в рутубе студии на хуавее изменить остальные данные,УПРАВЛЕНИЕ АККАУНТОМ
"Немого настроить профиль. Настраиваю пол, куда вписать, могу это сделать в студии на смартфоне?",УПРАВЛЕНИЕ АККАУНТОМ
в андроиде студии как изменить название канала?,УПРАВЛЕНИЕ АККАУНТОМ
"можно свой ник сделать ""Кулинария"" в приложении Студия на андроиде?",УПРАВЛЕНИЕ АККАУНТОМ
"Добрый день.Я бы хотел удалить канал  так как не могу понять.Подскажите, пожалуйста, как это сделать? --Админ Тио Андроид студия",УПРАВЛЕНИЕ АККАУНТОМ
 здравствуйте прошу удалить аккаунт в студии на вашем канале так как случайно зарегистрировалась повторноудалить аккаунт необходимо с привязкой по номеру телефона скриншот в приложении --Надежда,УПРАВЛЕНИЕ АККАУНТОМ
"Здравствуйте, подскажите как загрузить обложку со смартфона на канал, в студии окноесть такое?",УПРАВЛЕНИЕ АККАУНТОМ
"добрый день, можно приимерить другую обложку канала в студии на телефоне или нет?(",УПРАВЛЕНИЕ АККАУНТОМ
Как поменять обложку в профиле канала в рутуп стутии?,УПРАВЛЕНИЕ АККАУНТОМ
"Здравствуйте. Скажите, пожалуйста, можно дли дать доступ к управлению каналом администратору и как его назначить в риложении студии?  есть ли у нас где-то инструкция?",ПРЕДЛОЖЕНИЯ
"Добрый день!Как мне создать доступ для администратора канала, чтобы он смог автономно заходить и размещать видео и пр. через приложение студии",ПРЕДЛОЖЕНИЯ
Не понимаю как управлять каналом другим с тудии рутуба на смартфоне,ПРЕДЛОЖЕНИЯ
Можно управлть каналом грузить видео на чужой профиль только на сайте? В приложении студии сделайте так,ПРЕДЛОЖЕНИЯ
"приложение студии 50/50 сыровато дизайн как для дедушек если было бы более мимолистично по типу как в ютубе было бы имба и скажите пожалуйста какую обложку можно загружать на канала, не могу разобраться ",УПРАВЛЕНИЕ АККАУНТОМ
"На 4 с минусом на момент начала 2021гПоследние пять лет сколько не заходил  на РuTube то сразу закрывал страницу. Какой-то совершенно невнятный интерфейс и неясно можно грузить обложку или нет и какую,хочу поменять уже оформление канала",УПРАВЛЕНИЕ АККАУНТОМ
Добрый день! Не получается загрузить обложку к каналу. Формат что ль не тот . Подскажите пожалуйста,УПРАВЛЕНИЕ АККАУНТОМ
