user_question,label_1
Какой вид субтитров у вас? Сами генерите или надо закачивать?,ОТСУТСТВУЕТ
Автосубтитры? Это как?,ВИДЕО
Что за автоматические субтитры?,ВИДЕО
"Какие у вас правила для того, чтобюы я мог добавить субтитры?",ВИДЕО
Напишите правила для раазмещения субтитров,ВИДЕО
Какие правила размещения субтитров,ВИДЕО
Можено в трансляции включить субтитры?,ПРЕДЛОЖЕНИЯ
Доступен ли функционал субтитров трансляции?,ПРЕДЛОЖЕНИЯ
В записи трансляции появятся субтитры?,ПРЕДЛОЖЕНИЯ
Есть ли субтитры для записи трансляции?,ПРЕДЛОЖЕНИЯ
После того как трансляция сохраниться будут ли субтитры?,ПРЕДЛОЖЕНИЯ
Можно скачать видео на свой ПК?,ОТСУТСТВУЕТ
Можно ли скачивать видео к себе на компьютер?,ОТСУТСТВУЕТ
"Хочу скачать видео на ноутбук, это можно сделать?",ОТСУТСТВУЕТ
Как изменить видеоролик?,ВИДЕО
Как мне изменить мой ролик?,ВИДЕО
что за 18+ рядом с моим видео? Как убрать?,МОДЕРАЦИЯ
Уберите значек 18+ что это вообще такое,МОДЕРАЦИЯ
"Я ухочу удалить видео, как это сделать?",УПРАВЛЕНИЕ АККАУНТОМ
как удалить собственное видео?,УПРАВЛЕНИЕ АККАУНТОМ
"у меня на телевизоре появился код, куда его ввести?",УПРАВЛЕНИЕ АККАУНТОМ
Зачем мне код на телевизоре куда его вводить?,УПРАВЛЕНИЕ АККАУНТОМ
Как оформить платную подписку и что она дает7,УПРАВЛЕНИЕ АККАУНТОМ
Что такое платная подписка?,УПРАВЛЕНИЕ АККАУНТОМ
"списали деньги за какую-то подписку, я ничего не продлевал?",УПРАВЛЕНИЕ АККАУНТОМ
"За что списали деньги по подписке, я ничего не продлевал!",УПРАВЛЕНИЕ АККАУНТОМ
"Видео не соответствует вашим правилам, как пожаловаться?",МОДЕРАЦИЯ
Этот ролик нарушает закон,МОДЕРАЦИЯ
"Есть видео у вас, которые противоречат законам рф, что сделать?",МОДЕРАЦИЯ
"Удалите мой ролик, я не давал разрешение на публикацию",МОДЕРАЦИЯ
Моё видео опубликовали без спроса,МОДЕРАЦИЯ
"Я не побликовал этот ролик, он мой",МОДЕРАЦИЯ
"Пишет браузер устарел, что делать?",ОТСУТСТВУЕТ
"у меня старая версия браузера, что делать?",ОТСУТСТВУЕТ
Как обновить браузер?,ОТСУТСТВУЕТ
Какой формат видео могу загрузить?,ВИДЕО
Какое видео могу загрузить?,ВИДЕО
"Какие требования для загрузки, вес, качество и тд",ВИДЕО
Технические требования для обложки видео?,ВИДЕО
Какая должна быть обложка по размеру?,ВИДЕО
Сколько видео сразу могу поставть на загрузку?,ВИДЕО
я МОГУ ЗАГРУЗИТЬ 10 ВИДЕО СРАЗУ?,ВИДЕО
Можно ли разместить видео с вертикальной ориентацией?,ВИДЕО
Можно загрузить вертикальное видео?,ВИДЕО
Как загрузить видос в 360?,ВИДЕО
Можно ли понаромное фидео выложить?,ВИДЕО
Как много можно плейлистоа?,ВИДЕО
Сколько плейлисьов могу сделать?,ВИДЕО
Плейлист сколько вмещает?,ВИДЕО
Сколько в плейлисе может быть видео?,ВИДЕО
Есть отложенные публикации?,ВИДЕО
Можно запланировать выход видео на определенное время?,ВИДЕО
Как часто могу делать публикации видео с отложенным исполнением?,ВИДЕО
Сколько должно пройти между отложенными?,ВИДЕО
"Как сменить день в дате публикации, котрая в отложеном",ВИДЕО
Как поменять время отложки?,ВИДЕО
хочу поменять ролик,ВИДЕО
Как поменять видео?,ВИДЕО
Как убрать непонятную метку 18+,МОДЕРАЦИЯ
"У меня такой вопрос, че за 18+, как это убрать?",МОДЕРАЦИЯ
Что за метка 18+? Уберите её,МОДЕРАЦИЯ
Как скачать видео?,ОТСУТСТВУЕТ
Как можно скачать видео,ОТСУТСТВУЕТ
Как скачать???,ОТСУТСТВУЕТ
Как закрепить видео кстати?,УПРАВЛЕНИЕ АККАУНТОМ
как мне закрепить одно видео наа главной канала?,УПРАВЛЕНИЕ АККАУНТОМ
В каком порядке видео располагаются на канале?,ВИДЕО
В каком порядке видео у меня настранице?,ВИДЕО
"Подскажите, можно ли изменить порядок расположения видео на странице? Или только через полное удоление?",УПРАВЛЕНИЕ АККАУНТОМ
"Можно ли внутри канала на вкладке ""видео"" как-то менять порядок видео?",УПРАВЛЕНИЕ АККАУНТОМ
"Добрый день! Помогите пожалуйста, если возможно сменить порядок видео. Загужал видео, сразу по несколько штук, а они получается не по порядку загрузились..",УПРАВЛЕНИЕ АККАУНТОМ
Могу ли я с ютуба загружать сюда видео?,ВИДЕО
можно загружать сюда ролики с ютутб,ВИДЕО
Здравствуйте. Как можно перенести все видео с YouTube?,ВИДЕО
Могу перенсти видео с ютуба к себе на канал?,ВИДЕО
Могу ли перенести весь канал с youtube?,ВИДЕО
не загружается видео,ВИДЕО
Опять вышла ошибка придекодировании видео. В чем причина....,ВИДЕО
"У видео отстает звук, поможете?",ВИДЕО
Что делать если рассинхрон идёт по видео и звуку?,ВИДЕО
Видео загрузилось и там отстает звук,ВИДЕО
"Не могу загрузить видео просит подвердить почту, я это уже делал, что теперь?",ВИДЕО
"Почта уже подтверждена, но её зачем-то просят подтвердить снова при загрузке видео",ВИДЕО
"Я не могу загрузить почту, почему-то просит подтверждения почты, я это уже делал",ВИДЕО
"У меня такой вопрос, через сколько времени видео начнут появляться в поиске на рутебе",ПОИСК
Добрый день! Почему мои ролики не выходят по названию в поиске? они показываются аудитории или нет?,ПОИСК
нет моего видео в поисковике,ПОИСК
"Видео уже загрузил, а его почему-то нет?",МОДЕРАЦИЯ
"Загрузка видео прошла, но его почему-то нет на рутубе.",МОДЕРАЦИЯ
"Загрузка видео завершена, а его нет",МОДЕРАЦИЯ
Добрый день! Подскажите обзор по системам видеонаблюдения в какую категорию разместить?,ВИДЕО
"Если у меня тема Бизнес финансы какую категорию мне выбрать, образование или люди и блоги. У вас конкретики нет",ВИДЕО
"Здравствуйте!Меня зовут Дмитрий. Зарегистрировался на вашем сервере. Хочу проводить стримы - трансляции и рассказывать про вакансии, минут по 10 при создании стрима, какую категорию указывать?",ВИДЕО
"Здравствуйте, опять изменилась категория ролика с музыки на развлечение! Верните обратно , пожалуйста",МОДЕРАЦИЯ
"Почему категория поменялась, было разное категория?",МОДЕРАЦИЯ
"здравствуйте, система неправильно выставляет категорию на мои видео. У меня категория ""детское"" а ставится ""Разное"" или ""Развлечения"". можно ли поменять категории на моих видео?",МОДЕРАЦИЯ
Как удалить видео? ,ВИДЕО
здравствуйте. Как удалить видео с моего канала?,ВИДЕО
Здравствуйте. Возможно ли на Rutube добавлять таймкоды для видео - определенные временные метки,ВИДЕО
Добрый день! Как добавить таймкоды в видео?,ВИДЕО
Как добавить временные интервалы,ВИДЕО
В каком формате добавляются таймкоды?,ВИДЕО
Как мне правильно указать тайм-код?,ВИДЕО
Как правильно указывать время под видео?,ВИДЕО
Что нельзя публиковать на RUTUBE?,МОДЕРАЦИЯ
Почему могут отключить монетизацию из-за авторского права на видео и как этого избежать?,МОНЕТИЗАЦИЯ
Почему могут отключить монетизацию из-за искусственного завышения показателей на видео и как этого избежать? ,МОНЕТИЗАЦИЯ
"Для каких статусов доступна монетизация, и почему могут отключить монетизацию из-за изменения юридического статуса на видео, как этого избежать?",МОНЕТИЗАЦИЯ
"Какой контент можно использовать для монетизации, то есть в коммерческих целях?",МОНЕТИЗАЦИЯ
Какие материалы защищены авторским правом?,МОДЕРАЦИЯ
Как подтвердить права на использование контента для монетизации?,МОНЕТИЗАЦИЯ
"Кому принадлежат авторские права на контент, который я размещаю на платформе?",МОДЕРАЦИЯ
Можно ли цитировать чужие произведения?,МОДЕРАЦИЯ
Могу ли я использовать небольшие фрагменты фильмов для создания своих видео?,МОДЕРАЦИЯ
Можно ли свободно использовать материалы из интернета или из общего доступа?,МОДЕРАЦИЯ
"Можно ли использовать в видео материалы, которые распространяются по свободной лицензии?",МОДЕРАЦИЯ
Можно ли публиковать видео с чтением чужих книг и их переводов?,МОДЕРАЦИЯ
Нарушает ли авторские права использование образа персонажа игры/фильма/сериала?,МОДЕРАЦИЯ
"Почему вы не разглашаете, чьи авторские права я нарушаю?",МОДЕРАЦИЯ
"Как пожаловаться на видео, если оно нарушает авторские права?",МОДЕРАЦИЯ
Что такое мобильное приложение Студия RUTUBE?,УПРАВЛЕНИЕ АККАУНТОМ
Какие функции доступны в приложении Студия RUTUBE?,УПРАВЛЕНИЕ АККАУНТОМ
На каких операционных системах доступно приложение Студия RUTUBE?,ДОСТУП К RUTUBE
Как узнать версию приложения Студия RUTUBE?,ОТСУТСТВУЕТ
Как зарегистрироваться в приложении Студия RUTUBE?,УПРАВЛЕНИЕ АККАУНТОМ
Как авторизоваться в приложении Студия RUTUBE?,УПРАВЛЕНИЕ АККАУНТОМ
Можно ли авторизоваться в приложении Студия RUTUBE под уже существующим аккаунтом?,УПРАВЛЕНИЕ АККАУНТОМ
Можно ли авторизоваться (выполнить вход) в приложении Студия RUTUBE без ввода проверочного кода?,УПРАВЛЕНИЕ АККАУНТОМ
Как выйти из аккаунта в приложении Студия RUTUBE?,УПРАВЛЕНИЕ АККАУНТОМ
Можно ли изменять данные профиля в приложении Студия RUTUBE?,УПРАВЛЕНИЕ АККАУНТОМ
Можно ли изменять название и описание профиля канала в приложении Студия RUTUBE?,УПРАВЛЕНИЕ АККАУНТОМ
Можно ли удалить канал через приложение Студия RUTUBE?,УПРАВЛЕНИЕ АККАУНТОМ
Можно ли изменить обложку канала и фото профиля в приложении Студия RUTUBE?,УПРАВЛЕНИЕ АККАУНТОМ
Можно ли выдать доступы к студии канала через приложение Студия RUTUBE?,ПРЕДЛОЖЕНИЯ
Можно ли управлять другим каналом через приложение Студия RUTUBE?,ПРЕДЛОЖЕНИЯ
Какие требования к обложке канала?,УПРАВЛЕНИЕ АККАУНТОМ
"Можно ли менять местами или скрыть разделы во вкладке ""Обзор"" в приложении Студия RUTUBE?",ПРЕДЛОЖЕНИЯ
Как посмотреть аналитику по конкретному видео в приложении Студия RUTUBE?,ПРЕДЛОЖЕНИЯ
Как посмотреть доход по конкретному видео в приложении Студия RUTUBE?,ПРЕДЛОЖЕНИЯ
Как подключиться к партнерской программе в приложении Студия RUTUBE?,ПРЕДЛОЖЕНИЯ
Как создать плейлисты в приложении Студия RUTUBE?,ПРЕДЛОЖЕНИЯ
Можно ли загружать видео или Shorts в приложении Студия RUTUBE?,ВИДЕО
Можно ли в приложении Студия RUTUBE создавать и вести трансляции?,ПРЕДЛОЖЕНИЯ
"Можно ли отсортировать видео по статусу в категории ""Модерация/Отклонено"" в приложении Студия RUTUBE?",ПРЕДЛОЖЕНИЯ
Какие требования к обложке видео?,ВИДЕО
Можно ли работать с комментариями в приложении Студия RUTUBE?,ПРЕДЛОЖЕНИЯ
Как перенести видео c YouTube на RUTUBE?,ПРЕДЛОЖЕНИЯ
Не могу зарегистрироваться/авторизоваться в приложении Студия RUTUBE. Что делать?  ,УПРАВЛЕНИЕ АККАУНТОМ
Как написать обращение в поддержку через приложение Студия RUTUBE? ,ОТСУТСТВУЕТ
Что такое мобильное приложение Студия RUTUBE?,УПРАВЛЕНИЕ АККАУНТОМ
Какие функции доступны в приложении Студия RUTUBE?,УПРАВЛЕНИЕ АККАУНТОМ
Где можно скачать приложение Студия RUTUBE?,ДОСТУП К RUTUBE
На каких операционных системах доступно приложение Студия RUTUBE?,ДОСТУП К RUTUBE
Как узнать версию приложения Студия RUTUBE?,ОТСУТСТВУЕТ
Доступно ли приложение Студия RUTUBE на планшетах?,ДОСТУП К RUTUBE
Как зарегистрироваться в приложении Студия RUTUBE?,УПРАВЛЕНИЕ АККАУНТОМ
Как авторизоваться в приложении Студия RUTUBE?,УПРАВЛЕНИЕ АККАУНТОМ
Можно ли авторизоваться в приложении Студия RUTUBE под уже существующим аккаунтом?,УПРАВЛЕНИЕ АККАУНТОМ
Можно ли авторизоваться (выполнить вход) в приложении Студия RUTUBE без ввода проверочного кода?,УПРАВЛЕНИЕ АККАУНТОМ
Как выйти из аккаунта в приложении Студия RUTUBE?,УПРАВЛЕНИЕ АККАУНТОМ
Можно ли изменять данные профиля в приложении Студия RUTUBE?,УПРАВЛЕНИЕ АККАУНТОМ
Можно ли изменять название и описание профиля канала в приложении Студия RUTUBE?,УПРАВЛЕНИЕ АККАУНТОМ
Можно ли удалить канал через приложение Студия RUTUBE?,УПРАВЛЕНИЕ АККАУНТОМ
Можно ли изменить обложку канала и фото профиля в приложении Студия RUTUBE?,УПРАВЛЕНИЕ АККАУНТОМ
Можно ли выдать доступы к студии канала через приложение Студия RUTUBE?,ПРЕДЛОЖЕНИЯ
Можно ли управлять другим каналом через приложение Студия RUTUBE?,ПРЕДЛОЖЕНИЯ
Какие требования к обложке канала?,УПРАВЛЕНИЕ АККАУНТОМ
"Можно ли менять местами или скрыть разделы во вкладке ""Обзор"" в приложении Студия RUTUBE?",ПРЕДЛОЖЕНИЯ
Как посмотреть аналитику по конкретному видео в приложении Студия RUTUBE?,УПРАВЛЕНИЕ АККАУНТОМ
Как посмотреть доход по конкретному видео в приложении Студия RUTUBE?,ПРЕДЛОЖЕНИЯ
Как подключиться к партнерской программе в приложении Студия RUTUBE?,ПРЕДЛОЖЕНИЯ
Как создать плейлисты в приложении Студия RUTUBE?,ПРЕДЛОЖЕНИЯ
Можно ли в приложении Студия RUTUBE создавать и загружать видео?,ВИДЕО
Можно ли в приложении Студия RUTUBE создавать и вести трансляции?,ТРАНСЛЯЦИЯ
"Можно ли отсортировать видео по статусу в категории ""Модерация/Отклонено""?",ПРЕДЛОЖЕНИЯ
Какие требования к обложке видео?,ВИДЕО
"Можно ли заблокировать пользователя, оставляющего оскорбительные комментарии?",ПРЕДЛОЖЕНИЯ
Сколько комментариев можно закрепить под видео?,ВИДЕО
Как перенести видео с YouTube на RUTUBE?,ПРЕДЛОЖЕНИЯ
Не могу зарегистрироваться/авторизоваться в приложении. Что делать?,УПРАВЛЕНИЕ АККАУНТОМ
Как написать обращение в поддержку через приложение Студия RUTUBE?,ОТСУТСТВУЕТ
Для чего нужны настройки доступа к студии канала в Студии RUTUBE?,УПРАВЛЕНИЕ АККАУНТОМ
Где находятся настройки доступа к студии канала в Студии RUTUBE?,УПРАВЛЕНИЕ АККАУНТОМ
"Какие данные пользователя потребуются, чтобы предоставить доступ к студии моего канала?",УПРАВЛЕНИЕ АККАУНТОМ
Как предоставить доступ к студии моего канала другому пользователю?,УПРАВЛЕНИЕ АККАУНТОМ
Можно ли предоставить доступ к студии канала другому пользователю по id канала?,УПРАВЛЕНИЕ АККАУНТОМ
"Можно ли предоставить доступ к студии канала другому пользователю, не зарегистрированному на RUTUBE?",ПРЕДЛОЖЕНИЯ
Скольким пользователям можно предоставить доступ к студии канала?,УПРАВЛЕНИЕ АККАУНТОМ
К какому количеству студий может быть одновременно предоставлен доступ одному пользователю?,УПРАВЛЕНИЕ АККАУНТОМ
Может ли один пользователь занимать сразу несколько ролей доступа в рамках студии одного канала?,ПРЕДЛОЖЕНИЯ
Можно ли через настройки канала в Студии RUTUBE предоставить полный доступ к моей студии?,ПРЕДЛОЖЕНИЯ
"Может ли пользователь, которому предоставлен доступ к студии канала, открывать доступ и назначать роли другим пользователям?",ПРЕДЛОЖЕНИЯ
"Можно ли отследить действия пользователей, которым выдали доступ к студии канала?",ПРЕДЛОЖЕНИЯ
"Может ли пользователь, которому предоставили доступ к студии канала, самостоятельно отказаться от него?",УПРАВЛЕНИЕ АККАУНТОМ
"Где посмотреть, к каким студиям мне предоставлен доступ?",УПРАВЛЕНИЕ АККАУНТОМ
"Могу ли я посмотреть, с какими студиями уже работает пользователь, которому я хочу предоставить доступ?",ПРЕДЛОЖЕНИЯ
Какие бывают роли в доступах к студии канала?,УПРАВЛЕНИЕ АККАУНТОМ
Какие возможности взаимодействия со Студией доступны пользователю с правами Редактора?,УПРАВЛЕНИЕ АККАУНТОМ
Сколько пользователей можно назначить на роль Редактора?,УПРАВЛЕНИЕ АККАУНТОМ
"Может ли пользователь с правами Редактора создать трансляцию, если у Владельца канала не указан в профиле номер телефона?",ПРЕДЛОЖЕНИЯ
Может ли пользователь с правами Редактора управлять подписками Владельца канала?,ПРЕДЛОЖЕНИЯ
