user_question,label_1
Что нужно будет предоставлять для участия в партнерской программе?,МОНЕТИЗАЦИЯ
Достаточно ли паспорта для подачи заявки на монетизацию или нужны будут еще какие-то документы?,МОНЕТИЗАЦИЯ
"Нужно ли предварительно верифицировать канал, чтобы участвовать в партнерской программе?",МОНЕТИЗАЦИЯ
Для подключения монетизации не обязательно быть официальным каналом?,МОНЕТИЗАЦИЯ
Есть ли требование к верификации канала для подключения монетизации?,МОНЕТИЗАЦИЯ
"хаявку мне не одобрили, что делать как верефицировать канал?",УПРАВЛЕНИЕ АККАУНТОМ
"Не согласен с тем, что я не дали статус официального канала",УПРАВЛЕНИЕ АККАУНТОМ
"Мне не подтвердили галочку, что теперь?",УПРАВЛЕНИЕ АККАУНТОМ
Очень долго не отвечают по заявке на верефикацию?,УПРАВЛЕНИЕ АККАУНТОМ
"Я давно подал заявку на подтверждение канала, но ответа нет",УПРАВЛЕНИЕ АККАУНТОМ
"Подавал заявку на галочку, очень давно нет ответа, как постпить?",УПРАВЛЕНИЕ АККАУНТОМ
я не понимаю что за монетизация?,МОНЕТИЗАЦИЯ
Что за монитизация?,МОНЕТИЗАЦИЯ
Сколько лет нада для монетизации?,МОНЕТИЗАЦИЯ
"Здравствуйте, может ли несовершенолетний подключить монетизацию на своём rutube канале?",МОНЕТИЗАЦИЯ
Здравствуйте такой вопрос. А если я не резидент РФ как подключить монетизация. Я же не могу оформить самозанятость.  Как в таком случае действовать ,ПРЕДЛОЖЕНИЯ
"Здравствуйте. У вас обновилась монетизация, но про резидентов ничего не сказано. Подскажите, планируется ли как-то решить вопрос с возможностью подключения монетизации из других стран нерезидентов?",ПРЕДЛОЖЕНИЯ
"Здравствуйте! Скажите, пожалуйста, недавно наша команда заметила кардинально обновлённую вкладку ""Монетизация"" в Rutube Studio нашего канала и хочет поинтересоваться, сама монетизация уже работает для нерезидентов Российской Федерации, и мы уже можем зарабатывать после того, как выполним все требования для этого? На всякий случай, наша команда работает на территории Молдавии (Республики Молдова).",ПРЕДЛОЖЕНИЯ
"Добрый день! При регистрации на монетизацию у вас нет пункта физическое лицо, только предприниматели. Физику под каким статусом регистрироваться? ",ПРЕДЛОЖЕНИЯ
Добрый день. А Вы не планирует как на Дзене сделать в монетизации «Физическое лицо»? Самозанятого регистрировать крайне не удобно.,ПРЕДЛОЖЕНИЯ
"Я физическое лицо, как монетизировать свой контент?",ПРЕДЛОЖЕНИЯ
Что мне прислать чтобы получать деньги?,МОНЕТИЗАЦИЯ
"Какие надо вам документы, чтобы одобрили заявку на монетизауию?",МОНЕТИЗАЦИЯ
Пришлите список документов для подключения монетизации,МОНЕТИЗАЦИЯ
"нужна ли галочка, чтобы подключить монетизацию",МОНЕТИЗАЦИЯ
"Есть ли необходимость верефицировать свой канал, чтобы у меня была монетизация?",МОНЕТИЗАЦИЯ
Сколько обычно рассматривается заявка на монетизацию?,МОНЕТИЗАЦИЯ
Долго ждать одобрения монетизации?,МОНЕТИЗАЦИЯ
"У меня 2 аккаунта, могу монетизировать оба?",МОНЕТИЗАЦИЯ
"Хочу создать ещё один канал и монетизиравать его, так можно?",МОНЕТИЗАЦИЯ
У нашей организации несколько каналов нужно можн ли получать деньги со всех калах?,МОНЕТИЗАЦИЯ
На одного человека можно монету включить на нескольких каналах?,МОНЕТИЗАЦИЯ
Можно ли оформить монетизацию на доверенного человека?,МОНЕТИЗАЦИЯ
Могу ли я оформить монетизацию по доверенности?,МОНЕТИЗАЦИЯ
Можно ли офрмить монетизацию за доуго человка?,ПРЕДЛОЖЕНИЯ
"Мне нужно оформитьмонетизацию на другого, нужно ли переофрмлять канал?",ПРЕДЛОЖЕНИЯ
"У меня канал с реактами на чужие ролики, за них платят?",МОНЕТИЗАЦИЯ
могу лия монетизировать контетнт где я смотрю кино?,МОНЕТИЗАЦИЯ
У видео 18+ есть монетизация?,МОНЕТИЗАЦИЯ
С ограничем по возрасту могу расчитывать на монетизацию?,МОНЕТИЗАЦИЯ
"Могу ли я подключить  монетизацию, на ролики которые уже были на рутуб?",МОНЕТИЗАЦИЯ
"Если я выкладываю ролики, которые ранее были на рубубе, то я могу за них получать деньги?",МОНЕТИЗАЦИЯ
"Подключил монетизацию, с какого моента мне начнет считаться вознаграждение?",МОНЕТИЗАЦИЯ
"Я подключил монетизацию, с какого момента начнут считаться деньги?",МОНЕТИЗАЦИЯ
"Наконецто подключил монетизацию, с какого момента начнет считаться вознаграждение?",МОНЕТИЗАЦИЯ
 «Требуется дополнительная информация» для монетизации? Что ещё от меня нужно?,МОНЕТИЗАЦИЯ
"В личном кабинете есть надпись  «Требуется дополнительная информация», после подключения монетизации, что не так?",МОНЕТИЗАЦИЯ
из-за чего может быть отклонена монетизация?,МОНЕТИЗАЦИЯ
Почему по монетизации может быть отказ?,МОНЕТИЗАЦИЯ
"Здравствуйте!
Мне на почту от Вас не пришло письмо с инструкцией о том, что нужно исправить для восстановления выплат по партнерской программе. Сколько времени есть?",МОНЕТИЗАЦИЯ
"Сколько у меня есть, чтобы исправить нарушения?",МОНЕТИЗАЦИЯ
Сколько мне мдается на устранение нарушений на канале?,МОНЕТИЗАЦИЯ
"здраствуйте, отправляем Вам все лицензии на использование аудио/музыкального и иного контента, нарушения в описании группы устранены, видео с нарушениями-удалены. В ближайшее время будет отправлена повторная заявка. Сколько рассматрение?",МОНЕТИЗАЦИЯ
"Повторная проверка была отправлена,скак долго ждать??",МОНЕТИЗАЦИЯ
"Опять отправил заявку на монетизацию, сейчас сколько ждать?",МОНЕТИЗАЦИЯ
Где есть аналитика по деньгам?,МОНЕТИЗАЦИЯ
Как ине посмотреть аналитику по монетизации?,МОНЕТИЗАЦИЯ
Где у вас раздел аналититики по монеитизации?,МОНЕТИЗАЦИЯ
Сколько вы платите на 1000 просмотров?,МОНЕТИЗАЦИЯ
Сколько примерно платят за 1000 просмотров?,МОНЕТИЗАЦИЯ
"Здравствуйте, сколько платят за 1000 просмотров ? не понятно как работает монетизация да и вроде платить стали меньше, раньше как-то больше за месяц выходило около 150 рублей а сейчас по 2-3 рублям",МОНЕТИЗАЦИЯ
Добрый день не могу понят ькак вывести баланс?,МОНЕТИЗАЦИЯ
"Здравствуйте, подскажите как вывести деньги, к выводу 5600 руб",МОНЕТИЗАЦИЯ
Как вывести деньги?,МОНЕТИЗАЦИЯ
Добрый день!Как часто происходит обновление статистики в Монетизации?,МОНЕТИЗАЦИЯ
"Здравствуйте, информается по монетизации как часто обновляется?",МОНЕТИЗАЦИЯ
"Добрый день, случайно отключила рекламу и участие в партнерской программе на канале, подскажите пожалуйста, как подключить обратно?",МОНЕТИЗАЦИЯ
"добрый день, я по ошибке отключил рекламу, как её включить. спасибо.",МОНЕТИЗАЦИЯ
Куда направть уведомление об исключительности прав?,МОНЕТИЗАЦИЯ
"Мне нужно отправить уведомление об исключительности прав, куда это можно сделать?",МОНЕТИЗАЦИЯ
Куда можно направить уведомление об исключительности прав?,МОНЕТИЗАЦИЯ
Что за можеерация?,МОДЕРАЦИЯ
Что такое эта ваша модерация?,МОДЕРАЦИЯ
Что происходит во время модерации?,МОДЕРАЦИЯ
Что вы смотрите на модерации?,МОДЕРАЦИЯ
Кто проводит модерацию?,МОДЕРАЦИЯ
"Как вы осушествляете модерацию, это люди или машины?",МОДЕРАЦИЯ
Вы модерируете сами или это роботы?,МОДЕРАЦИЯ
Сколь ждать модерации видео?,МОДЕРАЦИЯ
"Скажите, а сколько примерно по времени занимает модерация",МОДЕРАЦИЯ
"Здравствуйте! При модерации высветилось ""Видео удалено за нарушение пользовательского соглашения"". Не понимаю, что именно оно нарушает.",МОДЕРАЦИЯ
"Ваше видео отклонено, этьо что ?",МОДЕРАЦИЯ
"Почему пишет, что моё видео отклонено?",МОДЕРАЦИЯ
Мой ролик не прошел стадию модерации? В чём причина?,МОДЕРАЦИЯ
Что делать если моё виде не прошло вашу модерацию?,МОДЕРАЦИЯ
для чего нужно регистрироваться?,УПРАВЛЕНИЕ АККАУНТОМ
Зачем мне регистрация?,УПРАВЛЕНИЕ АККАУНТОМ
"что я должен ввести, чтобы зарегистрироваться?",УПРАВЛЕНИЕ АККАУНТОМ
что мне нужно чтобы пройти регистрацию?,УПРАВЛЕНИЕ АККАУНТОМ
"Подтверждение e-mail, это что?",УПРАВЛЕНИЕ АККАУНТОМ
"Подтверждение e-mail, что за ссылка пришла?",УПРАВЛЕНИЕ АККАУНТОМ
Не приходит письмо с подтверждением регистрации,УПРАВЛЕНИЕ АККАУНТОМ
Что делать если не пришло письмо с подтверждением регистрации?,УПРАВЛЕНИЕ АККАУНТОМ
А как поменять пароль?,УПРАВЛЕНИЕ АККАУНТОМ
Хочу сменить пароль. Что делать?,УПРАВЛЕНИЕ АККАУНТОМ
"Я не помню пороль?, как востановить?",УПРАВЛЕНИЕ АККАУНТОМ
Есть возвращение пароля?,УПРАВЛЕНИЕ АККАУНТОМ
"Забыл пароль, но письма для восстановления нет.",УПРАВЛЕНИЕ АККАУНТОМ
не могу востановить пароль не приходит e-mail,УПРАВЛЕНИЕ АККАУНТОМ
"Не помню пароля, когда отправляю письмо ничего нет",УПРАВЛЕНИЕ АККАУНТОМ
"Я не помню пароля от почты, которую привязывал, как теперь быть?",УПРАВЛЕНИЕ АККАУНТОМ
"Не могу хайти на привязанную почту, что делать?",УПРАВЛЕНИЕ АККАУНТОМ
"Мой имейл сейчас недостпен, который я добавлял сюда",УПРАВЛЕНИЕ АККАУНТОМ
как поменять номер телефона?,УПРАВЛЕНИЕ АККАУНТОМ
Как перепреривязать номер телефона?,УПРАВЛЕНИЕ АККАУНТОМ
Как изменить свой номер?,УПРАВЛЕНИЕ АККАУНТОМ
"Пишет, что не верный пароль, что теперь?",УПРАВЛЕНИЕ АККАУНТОМ
Говорит что пользователя не существует или неверный пароль?,УПРАВЛЕНИЕ АККАУНТОМ
"Пишет что нет такого пользователя или неверный пороль, ввожу всё корректно, что теперь делать?",УПРАВЛЕНИЕ АККАУНТОМ
Как удалить аккаунт?,УПРАВЛЕНИЕ АККАУНТОМ
"Прошу прощения! Удалите, пожалуйста:",УПРАВЛЕНИЕ АККАУНТОМ
хочу удалить канал,УПРАВЛЕНИЕ АККАУНТОМ
Здравствуй восстановите акаунт пожалуйста ,УПРАВЛЕНИЕ АККАУНТОМ
"Удалил свой аккаунт, восстановите плих",УПРАВЛЕНИЕ АККАУНТОМ
"На сайт не пускает, пишет что заблокировали",МОДЕРАЦИЯ
"Иеня заблокировали и не пускает, что не так?",МОДЕРАЦИЯ
"Я из Кахастана, как харегистрироваться?",УПРАВЛЕНИЕ АККАУНТОМ
Можно ли зарегистрироваться если я нахожусь за пределами РФ?,УПРАВЛЕНИЕ АККАУНТОМ
Что за личный канал?,УПРАВЛЕНИЕ АККАУНТОМ
"Мой канал, это что такое?",УПРАВЛЕНИЕ АККАУНТОМ
Что такое личный канал?,УПРАВЛЕНИЕ АККАУНТОМ
Как сделать канал?,УПРАВЛЕНИЕ АККАУНТОМ
"Хочу завести канал на рутуб, как это сделать?",УПРАВЛЕНИЕ АККАУНТОМ
Как мне завсти канал?,УПРАВЛЕНИЕ АККАУНТОМ
Как поменять названия канала?,УПРАВЛЕНИЕ АККАУНТОМ
Хочк изменить название канала как это сделать?,УПРАВЛЕНИЕ АККАУНТОМ
"Мне нужно поменять название канала, подскажитье, пожалуйста, как?",УПРАВЛЕНИЕ АККАУНТОМ
че такое студия рутуб?,УПРАВЛЕНИЕ АККАУНТОМ
Студя рутуб это что?,УПРАВЛЕНИЕ АККАУНТОМ
Как мне получать пожертвования?,БЛАГОТВОРИТЕЛЬНОСТЬ ДОНАТЫ
Могу получать донаты?,БЛАГОТВОРИТЕЛЬНОСТЬ ДОНАТЫ
Донаты у вас есть?,БЛАГОТВОРИТЕЛЬНОСТЬ ДОНАТЫ
Как подключть донаты?,БЛАГОТВОРИТЕЛЬНОСТЬ ДОНАТЫ
Пожертвования как включить?,БЛАГОТВОРИТЕЛЬНОСТЬ ДОНАТЫ
"Видел кнопку ""поддержать автора"", хочу такую включить, как?",БЛАГОТВОРИТЕЛЬНОСТЬ ДОНАТЫ
Какие донатилки могу подключить?,БЛАГОТВОРИТЕЛЬНОСТЬ ДОНАТЫ
На какие сервисы донатов могу указать ссылки,БЛАГОТВОРИТЕЛЬНОСТЬ ДОНАТЫ
На какие сервисы мне могкт донатить?,БЛАГОТВОРИТЕЛЬНОСТЬ ДОНАТЫ
Как получить ссылку на сервис донатов?,БЛАГОТВОРИТЕЛЬНОСТЬ ДОНАТЫ
Как я могу получить ссылку на пожертвование,БЛАГОТВОРИТЕЛЬНОСТЬ ДОНАТЫ
Где взять ссылку для донатов?,БЛАГОТВОРИТЕЛЬНОСТЬ ДОНАТЫ
Кого вы называете пользователем?,УПРАВЛЕНИЕ АККАУНТОМ
как стать пользователем?,УПРАВЛЕНИЕ АККАУНТОМ
Как стать автором?,УПРАВЛЕНИЕ АККАУНТОМ
как стать блоггером?,УПРАВЛЕНИЕ АККАУНТОМ
Как мне стать правообладателем?,ОТСУТСТВУЕТ
Как мне зарегестроваться как правообладатель,ОТСУТСТВУЕТ
Что ещё за проавообладатель?,ОТСУТСТВУЕТ
Стримы это что такое?,ТРАНСЛЯЦИЯ
"Трансляции, что это такое?",ТРАНСЛЯЦИЯ
Что во время стрима можно?,МОДЕРАЦИЯ
Что делать во время прямого эфира можно?,МОДЕРАЦИЯ
Какие требования для подачи потока?,ТРАНСЛЯЦИЯ
С каким качеством могу стримит?,ТРАНСЛЯЦИЯ
Как начать стрим?,ТРАНСЛЯЦИЯ
Как запустить трансляцию?,ТРАНСЛЯЦИЯ
Как подрубить стримчанский?,ТРАНСЛЯЦИЯ
Как сделать эксклюзивный стрим?,ТРАНСЛЯЦИЯ
"Здравствуйте, как мне утроить приватный стрим?",ТРАНСЛЯЦИЯ
"Как сделать личный стрим, чтобы никто не видил?",ТРАНСЛЯЦИЯ
"Написана, что нужно подтвердить телефон, зачем?",ТРАНСЛЯЦИЯ
Зачем привяхывать телефон?,ТРАНСЛЯЦИЯ
как подтвердить телефон?,ТРАНСЛЯЦИЯ
как мне подтвердить номер телефона?,ТРАНСЛЯЦИЯ
каким образом подтверждаите номер ?,ТРАНСЛЯЦИЯ
Пишет что нужно заполнит загаловак для трансляции зачем?,ТРАНСЛЯЦИЯ
заголовок и описание в эфире? зачемЕ?,ТРАНСЛЯЦИЯ
Что за облошка на трансляции?,ТРАНСЛЯЦИЯ
лбложка трансляции что это?,ТРАНСЛЯЦИЯ
Что за чат в окне?,ТРАНСЛЯЦИЯ
онлайн чта какой-то что с ним делать?,ТРАНСЛЯЦИЯ
"Чат онлайна куда мне его, как управлять?",ТРАНСЛЯЦИЯ
"после того как закончу стримить, что будет?",ТРАНСЛЯЦИЯ
что с видео после стрима будет?,ТРАНСЛЯЦИЯ
Запись потока после окончания стирается?,ТРАНСЛЯЦИЯ
Приватный стрим сохранится?,ТРАНСЛЯЦИЯ
После окончания стрима по ссылке он сохраняется?,ТРАНСЛЯЦИЯ
"Личный стрим, только для тех с кем я поделился ссылкой сохраниться?",ТРАНСЛЯЦИЯ
Запись трансляции можно удалить?,ТРАНСЛЯЦИЯ
Можно избавиться от записи потока после окончания?,ТРАНСЛЯЦИЯ
Как скачать запись стрима?,ТРАНСЛЯЦИЯ
"хочу себе запись трансляции, чтобы подмонтировать потом, как сделать?",ТРАНСЛЯЦИЯ
Можно ли скаяать запись стрима?,ТРАНСЛЯЦИЯ
"Я сняла поздравления для внучка, а как мне его теперь загрузить к вам или только блогееры к вам могут загружать?",ВИДЕО
как разместить видо на платформе?,ВИДЕО
"Какие условифмя должны быть, чтобы видео загрузилось?",ВИДЕО
"Какие параметры должны быть у аидеоо ролика, чтобы он успешно загрузился?",ВИДЕО
не могу загрущить видео возникла ошибка,ВИДЕО
ошибка при загрузке видео,ВИДЕО
"У моего видео звук отстает от видео, что делать?",ВИДЕО
"Что делаеть, если видео отстает от звука, такого не должно быть вот оригинал",ВИДЕО
"Я уже подверждал e-mail, но во время загрузки видео снова просит",ВИДЕО
"возникает какято-то ошибка, просит подвердить мыло при загрузке видео, но ранее подтверждала",ВИДЕО
не могу пасматреть видео из-за ошибки что это?,ВИДЕО
появляется ошибка перед тем как запустить видео,ВИДЕО
почему такое низкое качество у видео?,ВИДЕО
видео которое я смотрю в очень низком качестве,ВИДЕО
Почнм нельзя смотреть видео в хорошем качестве?,ВИДЕО
Можете поставить мой ролик на главную?,СОТРУДНИЧЕСТВО ПРОДВИЖЕНИЕ РЕКЛАМА
как мне разместить видео на главной рутуба?,СОТРУДНИЧЕСТВО ПРОДВИЖЕНИЕ РЕКЛАМА
"Где сое видео, я его загрузил, а его нет",МОДЕРАЦИЯ
"нет моего видео, я его недавно загрузил",МОДЕРАЦИЯ
К какой категории относится мой клип,ВИДЕО
Как правильно выбрать категорию?,ВИДЕО
"С какой это стати мое виде теперь в разделе ""Лайфстайл""?",МОДЕРАЦИЯ
Почему сменили категорию без моего ведома?,МОДЕРАЦИЯ
Не могу нати кнопки включения субтитров,ВИДЕО
"Хочу посмотреть видео с субтитрами, куда жать?",ВИДЕО
Какую технологию вы используете для субтитров?,ОТСУТСТВУЕТ
У вас встроенные субтитры или сгенерированые?,ОТСУТСТВУЕТ
