user_question,label_2
я хочу начать трансляцию но на телефоне студия для андроид,Управление трансляцией
"скачала студию с рустора, как запустить стрим?",Управление трансляцией
есть возможность запуска стримой для студии андроида?,Управление трансляцией
Здравствуйте а как можно запустить трансляцию в студии ноо я на хуавее?,Управление трансляцией
"Здравствуйте, есть проблема нужна ваша помощь с приложением студии рутуба, устанавлиявал с ру маркета. У меня два канала в рутубе. В одном из них - основном, в качестве логина используется мой номер телефона. На другом основном канале в качестве логина эл поста. На основном канале хочу запустить трансляцию,  тут так можно?",Управление трансляцией
Не могу посмотреть СТС!,ТВ-эфиры
"Как смотреть эфир ренТВ, почему-то недоступно?",ТВ-эфиры
Что за трансляции у вас на сайте?,Управление трансляцией
"Увидел на рутубе трансляции, это тоже что и видео?",Управление трансляцией
А стримить - это как?,Управление трансляцией
Я смогу стримить в приложении?,Управление трансляцией
А с телефона можно стримить на рутуб?,Управление трансляцией
"Скачала ваше приложение, хотела записать стрим как гуляю по городу - у вас это можно в приложении?",Управление трансляцией
На Rutube любой может стримить?,Управление трансляцией
Кому можно проводить трансляции на вашем сайте?,Управление трансляцией
Я смогу стримить на Рутуб?,Управление трансляцией
"У нас планируется мероприятие, хотели запустить по нему сразу несколько прямых трансляций, такое возможно у вас?",Управление трансляцией
Могу я запустить несколько стримов?,Управление трансляцией
А сколько трансляций можно запустить одновременно?,Управление трансляцией
"Я сегодня буду стримить на своем ютуб канале, хотел запустить сразу на рутуб тоже, так можно?",Управление трансляцией
"Если я уже стримлю через ВК, я смогу на Рутуб запустить стрим?",Управление трансляцией
На моих стримах будет реклама?,Просмотр трансляции
Вы показываете рекламу на трансляциях?,Просмотр трансляции
"А реклама будет, если я запущу стрим?",Просмотр трансляции
Приватная трансляция это как?,Управление трансляцией
Чем отличается приватная трансляция от обычной?,Управление трансляцией
"Увидел в настройках трансляции ""доступ по ссылке"", что это такое?",Управление трансляцией
"Хочу провести приватную трансляцию, будет ли ее видно на моем канале для подписчиков?",Просмотр трансляции
"А трансляцию ""по ссылке"" как-то можно увидеть на моем канале?",Просмотр трансляции
Какие у вас требования к потоку?,Управление трансляцией
Какой битрейт выставлять для трансляции?,Управление трансляцией
Есть ли на Рутуб стримы в 60fps?,Просмотр трансляции
А трансляции на рутубе только 30 фпс?,Просмотр трансляции
Я смогу стримить в 60fps?,Управление трансляцией
"Не будет проблем с трансляцией, если я подам 60фпс?",Управление трансляцией
"Недавно зарегистрировался у вас, планирую проводить стримы с подписчиками из ТГ. Хотел узнать в 60 кадов получится стримить?",Управление трансляцией
Если я стримил в 60 кадров на записи тоже будет 60?,Управление трансляцией
"Сохранится ли качество в записи, если у меня трансляция в 60fps шла?",Управление трансляцией
Вы поддерживаете 60 кадров на записи трансляции?,Управление трансляцией
Как сделать пометку на трансляции что она 18+?,Управление трансляцией
"Можно ли провести трансляцию ""для взрослых"", чтобы от 18 лет только была?",Управление трансляцией
На Rutube есть тег 18+ для стримов?,Управление трансляцией
"Я наченающий блогер, хочу стать популярним стримером у вас, но пока незнаю что тут как. Расскажите пж куда нажать чтобы трансляцию сделать?))) спс",Управление трансляцией
Как завести трансляцию на Рутубе?,Управление трансляцией
Стримы с доступом только по ссылке - у вас такое есть?,Управление трансляцией
Я могу провести приватную трансляцию?,Управление трансляцией
"Хочу застримить так чтобы не видно было на канале и только по ссылке можно посмотреть, как мне сделать такой стрим?",Управление трансляцией
"Как мне сделать, чтобы мою трансляцию было не видно на канале?",Управление трансляцией
"Я хочу потестировать настройки для трансляции и мне не надо, чтобы ее видно было, можно как-то скрытый запуск сделать?",Управление трансляцией
Если я проводил скрытую трансляцию она сохранится в мои видео?,Управление трансляцией
Останется ли запись приватного стрима у меня на канале?,Управление трансляцией
"Сколько у вас можно стримить, какие лимиты?",Управление трансляцией
Сколько часов может быть трансляция на Рутубе?,Управление трансляцией
"У вас можно целый день стримить? А запись сколько сохранится, если стрим был длинный?",Управление трансляцией
"Не всегда успеваю к началу любимой передачи и стало интересно, а можно перемотать, чтобы сначала посмотреть?",Просмотр трансляции
У вас работает перемотка на трансляциях?,Просмотр трансляции
А реклама будет на трансляции?,Просмотр трансляции
На рутуб есть реклама в эфире?,Просмотр трансляции
Подскажите какую программу надо чтобы стримить?,Управление трансляцией
Через что у вас можно стримить?,Управление трансляцией
"Трансляция которую я смотрел уже закончилась, как я ее могу посмотреть снова?",Просмотр трансляции
У трансляции поменяется ссылка после окончания?,Просмотр трансляции
"Подскажите, какие настройки надо выставлять в OBS?",Управление трансляцией
"Я раньше никогда не стримил, не очень понимаю как все настроить. Помогите пожалуйста)",Управление трансляцией
Посоветуйте как лучше настроить vMix?,Управление трансляцией
У вас есть инфа как настроить vMix?,Управление трансляцией
"Не могу никак разобраться, какие настройки выставлять в vMix, не могли бы вы помочь?",Управление трансляцией
Стримы это что такое?,Управление трансляцией
"Трансляции, что это такое?",Управление трансляцией
Какие требования для подачи потока?,Управление трансляцией
С каким качеством могу стримит?,Управление трансляцией
Как начать стрим?,Управление трансляцией
Как запустить трансляцию?,Управление трансляцией
Как подрубить стримчанский?,Управление трансляцией
Как сделать эксклюзивный стрим?,Управление трансляцией
"Здравствуйте, как мне утроить приватный стрим?",Управление трансляцией
"Как сделать личный стрим, чтобы никто не видил?",Управление трансляцией
"Написана, что нужно подтвердить телефон, зачем?",Управление трансляцией
Зачем привяхывать телефон?,Управление трансляцией
как подтвердить телефон?,Управление трансляцией
как мне подтвердить номер телефона?,Управление трансляцией
каким образом подтверждаите номер ?,Управление трансляцией
Пишет что нужно заполнит загаловак для трансляции зачем?,Управление трансляцией
заголовок и описание в эфире? зачемЕ?,Управление трансляцией
Что за облошка на трансляции?,Управление трансляцией
лбложка трансляции что это?,Управление трансляцией
Что за чат в окне?,Чат/Комментарии
онлайн чта какой-то что с ним делать?,Чат/Комментарии
"Чат онлайна куда мне его, как управлять?",Чат/Комментарии
"после того как закончу стримить, что будет?",Управление трансляцией
что с видео после стрима будет?,Управление трансляцией
Запись потока после окончания стирается?,Управление трансляцией
Приватный стрим сохранится?,Управление трансляцией
После окончания стрима по ссылке он сохраняется?,Управление трансляцией
"Личный стрим, только для тех с кем я поделился ссылкой сохраниться?",Управление трансляцией
Запись трансляции можно удалить?,Управление трансляцией
Можно избавиться от записи потока после окончания?,Управление трансляцией
Как скачать запись стрима?,Управление трансляцией
"хочу себе запись трансляции, чтобы подмонтировать потом, как сделать?",Управление трансляцией
Можно ли скаяать запись стрима?,Управление трансляцией
Можно ли в приложении Студия RUTUBE создавать и вести трансляции?,Управление трансляцией
"В приложении RUTUBE для ТВ недоступны каналы СТС, Рен ТВ, Че, Домашний, что делать?",ТВ-эфиры
Что такое трансляции (стримы) на RUTUBE?,Управление трансляцией
В каких приложениях доступны прямые трансляции?,Управление трансляцией
Кому доступно проведение трансляций (стримов) на RUTUBE?,Управление трансляцией
Можно ли запускать несколько трансляций одновременно?,Управление трансляцией
"Есть ли ограничения на одновременное проведение трансляций на RUTUBE и на других площадках (YouTube, Twitch и VK)?",Управление трансляцией
Есть ли реклама на трансляциях?,Просмотр трансляции
Что такое приватная трансляция на RUTUBE?,Управление трансляцией
Будет ли приватная трансляция отображаться на личной странице (канале) пользователя и в разделе RUTUBE «Все трансляции»?,Просмотр трансляции
Рекомендации к потоку трансляции на RUTUBE,Управление трансляцией
С какой кадровой частотой могут идти трансляции на RUTUBE?,Просмотр трансляции
"Можно ли вести трансляции на RUTUBE, если подать поток в 60 FPS?",Управление трансляцией
"Если в трансляцию подать поток 60 FPS, то сохранится ли запись трансляции с этой кадровой частотой?",Управление трансляцией
Как присвоить трансляции (стриму) категорию 18+?,Управление трансляцией
Как создать трансляцию?,Управление трансляцией
Можно ли запускать приватные трансляции на RUTUBE?,Управление трансляцией
Как запустить приватную трансляцию?,Управление трансляцией
Сохранится ли приватная трансляция?,Управление трансляцией
Сколько может длиться трансляция (стрима)?,Управление трансляцией
Есть ли ограничения на перемотку трансляций (стримов)?,Просмотр трансляции
Есть ли реклама во время трансляции?,Просмотр трансляции
С помощью каких программ допускается вести трансляции на RUTUBE?,Управление трансляцией
По какой ссылке доступна запись трансляции?,Просмотр трансляции
Как настроить OBS Studio для проведения трансляций на RUTUBE? ,Управление трансляцией
Как настроить vMix для проведения трансляций на RUTUBE? ,Управление трансляцией
Что такое трансляции (стримы) на RUTUBE?,Управление трансляцией
Рекомендации к потоку трансляции,Управление трансляцией
Как создать трансляцию?,Управление трансляцией
Как запустить приватную трансляцию?,Управление трансляцией
Зачем нужно подтверждать номер телефона?,Управление трансляцией
Как проходит подтверждение номера телефона?,Управление трансляцией
Зачем нужен заголовок и описание для прямого эфира?,Управление трансляцией
Что такое обложка трансляции?,Управление трансляцией
Что такое онлайн-чат и как им управлять?,Чат/Комментарии
Что произойдет с моей трансляцией после ее окончания?,Управление трансляцией
Сохраняется ли приватная трансляция?,Управление трансляцией
Могу ли я удалить запись трансляции после ее окончания?,Управление трансляцией
Могу ли я скачать копию моей трансляции?,Управление трансляцией
